{
  "$schema": "http://json-schema.org/draft-07/schema#",
  "title": "SecurityFinding",
  "type": "object",
  "required": ["id", "title", "analysis_domain", "evidence", "impact", "confidence", "remediation"],
  "properties": {
    "id":              { "type": "string" },
    "title":           { "type": "string" },
    "analysis_domain": { "type": "string" },
    "evidence":        { "type": "string" },
    "impact":          { "type": "string" },
    "confidence":      { "type": "string", "enum": ["low", "medium", "high"] },
    "cwe":             { "type": "array",  "items": { "type": "string" } },
    "mitre_attck":     { "type": "array",  "items": { "type": "string" } },
    "cvss":            { "type": "string" },
    "remediation":     { "type": "string" },
    "verification_steps": { "type": "array", "items": { "type": "string" } }
  },
  "additionalProperties": false
}
